<!-- Library Estructura-->
<!ELEMENT library (book+)>

<!-- Books Estructura-->
<!ELEMENT book (title, author, year, publisher, pages)>
<!ELEMENT title (#PCDATA)>
<!ELEMENT author (#PCDATA)>
<!ELEMENT year (#PCDATA)>
<!ELEMENT publisher (#PCDATA)>
<!ELEMENT pages (#PCDATA)>